https://issafrica.org/iss-today/time-to-tackle-violence-against-women-in-mali 2020-11-25 On 26 September, hundreds of Malian women and some men rallied in Bamako to protest against the trivialisation of violence against women. This was prompted by the revelation on social media of alleged intimate partner abuse involving a famous Malian artist.
The story broke just two months before the 25 November annual international day for the elimination of violence against women. The case, now pending in court, sheds light on a society-wide problem that’s often silenced by deeply entrenched social norms and religious discourse. Fear on the part of the political elite to confront the divisive issue makes matters worse.
Official figures on violence against women are hard to find in Mali – even more so specific numbers on domestic and intimate partner violence. The country’s statistical capacities are generally weak, but this also indicates the low priority given to issues affecting women, especially gender-based violence.
The little data that is available, including through humanitarian protection monitoring mechanisms, emphasises conflict-related sexual and gender-based violence. This should be tracked and addressed as Mali struggles with a multidimensional crisis in its central and northern regions. But violence against women goes beyond this conflict.
Despite repeated appeals for reform, there’s been little progress on improving women’s lives and rights
In a 2017 interview, then chair of the national chapter of Women in Law and Development in Africa, Bouaré Bintou Founé Samaké, said 85% of the violence against women cases the organisation documented occurred in family settings. Samaké now heads the ministry in charge of women’s affairs in the transitional government, which opens new possibilities for action.
A 2018 National Institute of Statistics demographic and health survey showed that one in two Malian women aged 15 to 49 had suffered acts of physical or sexual violence. The same proportion faces emotional, physical and/or sexual abuse in the context of relationship break-ups. The survey also found that 79% of women and 47% of men considered physical violence by a man against his female partner to be normal and justifiable.
Women’s organisations have been vocal about the widespread nature of violence against women. But despite their repeated appeals for reforms, there’s been little progress towards improving the country’s framework to protect women’s lives and rights.
A 2019 draft law opposing violence against women proposed by women’s and other civil society organisations wasn’t adopted, partly due to pressure by powerful religious groups. To many, this felt like déjà-vu: in 2009 the National Assembly of Mali had passed a Family Law that leaned towards improving women’s rights and advancing gender equality. But this law was never enacted by the executive.
Pressure from religious groups led the administration of then president Amadou Toumani Touré to send the text back to Parliament. The version signed by the executive two years later removed all progressive dispositions for women’s rights.
A 2019 draft law on violence against women wasn’t adopted, partly due to pressure by religious groups
The September 2020 protest revived an old conversation on societal factors excusing violence against women, and the legal vacuum protecting perpetrators. This created an opportunity for transition authorities to do the right thing.
On 1 October, the Transition Charter was released, setting out the steps and priorities of the 18-month transition following the August coup. Given the complexity of the crisis and the limited timeframe, choices had to be made, and gender inequality wasn’t included in the roadmap’s six priority areas.
Nonetheless, by enacting long-overdue policies and laws that improve the safety of millions of women and girls, reform can be achieved during the transition. Political courage will be needed to carry an agenda of social justice and women’s rights in a country where this routinely triggers resistance by powerful conservative forces.
In October, the appointment of an 84% male transitional government by an all-male leadership was met with criticism. It fell short of the obligation in a 2015 law to include at least 30% of each sex in any nominations for public office. The backlash led to the transitional government making the inclusion of women a requirement for all groups to be represented in the National Transitional Council.
The council will probably involve a higher proportion of women than any previous legislature in Mali’s history. This creates a unique opportunity to raise issues affecting women on the national agenda.
A social justice and women’s rights agenda triggers resistance by powerful conservative forces
However, more women in the legislature won’t necessarily translate into greater gender equality in the country’s laws. These women will need to drive a violence against women agenda which calls for a clear sense of purpose, determination and support from women’s organisations and male allies in and outside government.
Without a specific law on violence against women, victims have few options to seek justice, especially as society stigmatises those who speak up. There is also nothing to deter perpetrators. Passing a law would help fight impunity, but it won’t be enough.
Effective implementation must follow, including in often-overlooked rural areas. Women will need to be made aware of their rights, and political leadership and drive will be essential to getting justice and security personnel on board. This will take profound mindset changes in institutional cultures that have minimised violence against women as a ‘private’ issue.
Such shifts are only possible if political commitment to improve the safety, status and overall conditions of women remains high. The transition period could set the tone and create a new norm for subsequent governments to live by.
Transitional authorities should champion the agenda for better representation of women in all areas of public service. This means observing the 30% minimum requirement in appointments during the transition and paving the way for it to be mandatory in the revised electoral framework.
It means reviewing public administration recruitment practices to increase the presence of women and offer them better career prospects. Measures are also needed to improve girls’ access to advanced education that prepares them for leadership positions.
Addressing violence against women in Mali will require more than a law. Society’s views on women need to change and the structural power imbalances between women and men must be rectified. To achieve this, girls need better access to education, and women need income-generating opportunities and representation in all areas of public and private sectors, including leadership.
Ornella Moderan, Head, Sahel Programme, ISS Bamako
This article was produced with support from the UK Conflict, Stability and Security Fund, and the Hanns Seidel Foundation.
In South Africa, Daily Maverick has exclusive rights to re-publish ISS Today articles. For media based outside South Africa and queries about our re-publishing policy, email us.
Photo: MINUSMA/Harandane Dicko On 26 September, hundreds of Malian women and some men rallied in Bamako to protest against the trivialisation of violence against women. This was prompted by the revelation on social media of alleged intimate partner abuse involving a famous Malian artist. The story broke just two months before the 25 November annual international day for the elimination of violence against women. The case, now pending in court, sheds light on a society-wide problem that’s often silenced by deeply entrenched social norms and religious discourse. Fear on the part of the political elite to confront the divisive issue makes matters worse. Official figures on violence against women are hard to find in Mali – even more so specific numbers on domestic and intimate partner violence. The country’s statistical capacities are generally weak, but this also indicates the low priority given to issues affecting women, especially gender-based violence. The little data that is available, including through humanitarian protection monitoring mechanisms, emphasises conflict-related sexual and gender-based violence. This should be tracked and addressed as Mali struggles with a multidimensional crisis in its central and northern regions. But violence against women goes beyond this conflict. Despite repeated appeals for reform, there’s been little progress on improving women’s lives and rights In a 2017 interview, then chair of the national chapter of Women in Law and Development in Africa, Bouaré Bintou Founé Samaké, said 85% of the violence against women cases the organisation documented occurred in family settings. Samaké now heads the ministry in charge of women’s affairs in the transitional government, which opens new possibilities for action. A 2018 National Institute of Statistics demographic and health survey showed that one in two Malian women aged 15 to 49 had suffered acts of physical or sexual violence. The same proportion faces emotional, physical and/or sexual abuse in the context of relationship break-ups. The survey also found that 79% of women and 47% of men considered physical violence by a man against his female partner to be normal and justifiable. Women’s organisations have been vocal about the widespread nature of violence against women. But despite their repeated appeals for reforms, there’s been little progress towards improving the country’s framework to protect women’s lives and rights. A 2019 draft law opposing violence against women proposed by women’s and other civil society organisations wasn’t adopted, partly due to pressure by powerful religious groups. To many, this felt like déjà-vu: in 2009 the National Assembly of Mali had passed a Family Law that leaned towards improving women’s rights and advancing gender equality. But this law was never enacted by the executive. Pressure from religious groups led the administration of then president Amadou Toumani Touré to send the text back to Parliament. The version signed by the executive two years later removed all progressive dispositions for women’s rights. A 2019 draft law on violence against women wasn’t adopted, partly due to pressure by religious groups The September 2020 protest revived an old conversation on societal factors excusing violence against women, and the legal vacuum protecting perpetrators. This created an opportunity for transition authorities to do the right thing. On 1 October, the Transition Charter was released, setting out the steps and priorities of the 18-month transition following the August coup. Given the complexity of the crisis and the limited timeframe, choices had to be made, and gender inequality wasn’t included in the roadmap’s six priority areas. Nonetheless, by enacting long-overdue policies and laws that improve the safety of millions of women and girls, reform can be achieved during the transition. Political courage will be needed to carry an agenda of social justice and women’s rights in a country where this routinely triggers resistance by powerful conservative forces. In October, the appointment of an 84% male transitional government by an all-male leadership was met with criticism. It fell short of the obligation in a 2015 law to include at least 30% of each sex in any nominations for public office. The backlash led to the transitional government making the inclusion of women a requirement for all groups to be represented in the National Transitional Council. The council will probably involve a higher proportion of women than any previous legislature in Mali’s history. This creates a unique opportunity to raise issues affecting women on the national agenda. A social justice and women’s rights agenda triggers resistance by powerful conservative forces However, more women in the legislature won’t necessarily translate into greater gender equality in the country’s laws. These women will need to drive a violence against women agenda which calls for a clear sense of purpose, determination and support from women’s organisations and male allies in and outside government. Without a specific law on violence against women, victims have few options to seek justice, especially as society stigmatises those who speak up. There is also nothing to deter perpetrators. Passing a law would help fight impunity, but it won’t be enough. Effective implementation must follow, including in often-overlooked rural areas. Women will need to be made aware of their rights, and political leadership and drive will be essential to getting justice and security personnel on board. This will take profound mindset changes in institutional cultures that have minimised violence against women as a ‘private’ issue. Such shifts are only possible if political commitment to improve the safety, status and overall conditions of women remains high. The transition period could set the tone and create a new norm for subsequent governments to live by. Transitional authorities should champion the agenda for better representation of women in all areas of public service. This means observing the 30% minimum requirement in appointments during the transition and paving the way for it to be mandatory in the revised electoral framework. It means reviewing public administration recruitment practices to increase the presence of women and offer them better career prospects. Measures are also needed to improve girls’ access to advanced education that prepares them for leadership positions. Addressing violence against women in Mali will require more than a law. Society’s views on women need to change and the structural power imbalances between women and men must be rectified. To achieve this, girls need better access to education, and women need income-generating opportunities and representation in all areas of public and private sectors, including leadership. Ornella Moderan, Head, Sahel Programme, ISS Bamako This article was produced with support from the UK Conflict, Stability and Security Fund, and the Hanns Seidel Foundation. In South Africa, Daily Maverick has exclusive rights to re-publish ISS Today articles. For media based outside South Africa and queries about our re-publishing policy, email us. Photo: MINUSMA/Harandane Dicko You can also  subscribe to events, media releases, ISS Today and specific topics. Get the ISS Weekly to stay ahead of Africa’s human security challenges.
http://www.understandingwar.org/backgrounder/russia-review-putins-%E2%80%9Cpeacekeepers%E2%80%9D-will-support-russian-wars By George Barros November 16, 2020 The Kremlin will likely cite Russia’s “peacekeeping mission” in Nagorno Karabakh in its 2021 bid to legitimize the Collective Security Treaty Organization (CSTO) as a United Nations (UN)-recognized peacekeeping force. The CSTO stated it plans to conduct negotiations with the UN in 2021 to hold CSTO peacekeeping operations under the UN’s auspices.[1] This stated effort aligns with the Kremlin’s assessed campaign to leverage the UN to justify Russia’s international military deployments—an important hybrid war capability the Kremlin is developing.[2] The Kremlin is likely leveraging the CSTO to manage perceptions about Russia’s military deployment to Nagorno Karabakh. The Kremlin deployed 1,960 Russian “peacekeepers” to Nagorno Karabakh on November 10.[3] These Russian personnel are unspecified elements of the Roshchinsky-based 15th Separate Motor Rifle Brigade, unspecified elements of the Ulyanovsk-based 31st Airborne Assault Brigade, and unspecified elements of the Kubina-based separate 45th Guards Spetsnaz Detached Brigade—a special operations unit of the Russian Airborne Forces (VDV).[4] This “peacekeeping” mission is an exclusively Russian undertaking and does not include any CSTO personnel, structures, or frameworks as of this writing. The CSTO, nonetheless, is supporting this Russian military deployment in the international information space.[5] CSTO Secretary General Stanislav Zas said that Russia’s peacekeeping mission helped established peace in Nagorno Karabakh on November 11.[6] The CSTO’s favorable coverage of an exclusively Russian operation may seek to create a larger false impression that the CSTO is somehow involved in this operation. The successful creation of this impression will lend the operation additional connotations of legitimacy through perceived CSTO backing or could support a new, formal CSTO involvement in the operation. Russian President Vladimir Putin likely seeks to blur the lines between Russian and CSTO activities as part of a hybrid warfare technique to obfuscate Russian activities. Russian President Vladimir Putin likely seeks to create an impression linking Russian “peacekeepers” in Nagorno Karabakh to “humanitarian assistance.” The Russian Defense Ministry began constructing an “Interdepartmental Center for Humanitarian Response” in Nagorno Karabakh’s capital of Stepanakert on November 15, 2020, as part of its operation in that region.[7] The Kremlin claims this center will coordinate Russian-led refugee resettlement and humanitarian efforts.[8] This effort helps the Kremlin frame its military personnel deployed abroad as legitimate humanitarian actors. The Kremlin is intensifying efforts to brand CSTO peacekeepers as a legitimate humanitarian force. The CSTO announced plans to add a special medical unit to the CSTO’s peacekeeping force on November 12 and called to build further capability to counter COVID-19 on November 13.[9] The Kremlin will likely leverage the addition of a mostly symbolic CSTO medical detachment to assist its framing of CSTO peacekeepers as a humanitarian force. The Kremlin previously included CSTO personnel and International Committee of the Red Cross observers in the October 2020 Unbreakable Brotherhood exercises in Belarus to frame Russian deployments to Belarus as legitimate and internationally accepted, despite Putin’s intensified efforts to undermine Belarus’s sovereignty.[10] Putin will likely increase Russian control over CSTO member states’ militaries on November 17. The CSTO will hold a security council secretariat committee meeting on November 17 to further formalize agreements on CSTO peacekeeping, equipping its Rapid Reaction Force (RRF), coalition security, military-technical cooperation, and counternarcotic efforts.[11] CSTO member states will likely sign two plans: one on joint training for command and control structures and joint military forces; and another on cooperation on foreign policy through the end of 2020 and the first half of 2021.[12] This will advance Putin’s larger campaign to subordinate former Soviet Union (FSU) states’ militaries to Russian-dominated structures. The CSTO RRF conducted a rapid response exercise in Medvezhi Ozera, Moscow Oblast, November 11-12, that could support a Russian military deployment to Belarus.[13] This exercise tested the RRF’s capabilities by using VDV signals elements as the CSTO’s command and control backbone for the first time. An unspecified number of Russian, Belarusian, Kazakh, Kyrgyz, and Tajik personnel participated in the exercise at the base of the 38th Separate Signals Regiment—the VDV’s only separate signals regiment.[14] The Russian Ministry of Defense did not state how many personnel participated in this exercise or provide the comprehensive readout that usually accompanies such exercises. The Kremlin likely seeks to increase the RRF’s effectiveness by leveraging the VDV’s expeditionary capabilities.[15] The Kremlin may deploy CSTO “peacekeepers” to Belarus using the CSTO RRF. Self-declared Belarusian President Alexander Lukashenko gave an interview on November 13 in which he praised deeper integration with Russia via the CSTO as the “main remedy” for color revolutions.[16] The Kremlin may brand a potential future conventional Russian military deployment to Belarus as a CSTO multinational “peacekeeping” mission to conceal Putin’s intent to use such a deployment to further integrate Belarus into Russia. CSTO member states will likely begin developing information technology (IT) under a Kremlin-controlled unified security framework. CSTO member states agreed on the necessity to develop “uniform [IT] rules between states” to ensure collective security on November 12.[17] CSTO member states reportedly are developing a five-year plan to harmonize legislation on IT regulations, including the creation of a single digital signature among CSTO states.[18] This effort to control CSTO states’ IT regulations on the Kremlin’s terms advances several larger Kremlin campaigns, including the Kremlin’s campaign to contest the West in international information and communications technologies—a campaign the Kremlin launched in 2014.[19] This effort, if successful, will likely increase Russian access to CSTO members’ IT technical networks, increasing Russia’s cyber capabilities.[20] The United States and NATO should take several steps to mitigate these threats. The West should closely monitor Russian-led “peacekeeping missions” to challenge Putin’s assertions that these operations are humanitarian in nature when they could, in fact, support hybrid wars. The West should call out Russian efforts to undermine FSU states’ sovereignty by subordinating their militaries and IT industries to Russian-dominated structures. The West should also call out Russian efforts to manipulate the information space by characterizing its hybrid operations as “peacekeeping missions.” Western leaders should pressure the UN not to recognize the CSTO as a legitimate peacekeeping force.   [1] https://sputnik dot by/defense_safety/20201016/1045917923/ODKB-provedet-peregovory-s-OON-ob-uchastii-v-mirotvorcheskikh-operatsiyakh.html; https://www.youtube.com/watch?v=yiuyVyRIEVg [2] http://www.understandingwar.org/sites/default/files/Russian%20Hybrid%20W... ; http://www.understandingwar.org/sites/default/files/Putin%27s%20Offset%2... [3] http://www.understandingwar.org/backgrounder/russian-president-putin-win... [4] https://iz dot ru/1084928/izvestiia/noch-mira-kak-armeniia-i-azerbaidzhan-podelili-karabakh [5] https://iz dot ru/1084928/izvestiia/noch-mira-kak-armeniia-i-azerbaidzhan-podelili-karabakh; http://www.understandingwar.org/backgrounder/russian-president-putin-win... [6] https://regnum dot ru/news/polit/3112721.html [7] https://www.gazeta dot ru/army/news/2020/11/15/15231445.shtml [8] https://www.gazeta dot ru/army/news/2020/11/15/15231445.shtml [9] https://tj.sputniknews dot ru/defense_safety/20201112/1032255355/ODKB-meditsinskii-otryad-spetsnaznacheniya.html; https://regnum dot ru/news/3114827.html [10] http://www.understandingwar.org/backgrounder/russia%E2%80%99s-unpreceden... [11] https://www.mil dot by/ru/news/107815/ [12] https://www.mil dot by/ru/news/107815/ [13] http://www.understandingwar.org/backgrounder/belarus-warning-update-upco... [14] https://function.mil dot ru/news_page/country/more.htm?id=12324138@egNews; https://function.mil dot ru/news_page/country/more.htm?id=12324112@egNews; https://rg dot ru/2020/11/12/reg-cfo/sily-odkb-oprobovali-novuiu-sistemu-upravleniia.html; https://voinskayachast dot net/vozdushno-desantnie-voyska/vch54164 © VoinskayaChast.net; https://upload.wikimedia.org/wikipedia/commons/4/47/Russian_Airborne_For... [15] http://www.understandingwar.org/backgrounder/belarus-warning-update-upco... [16] https://www.belta dot by/president/view/splotitsja-i-vystupit-edinym-frontom-lukashenko-nazval-glavnoe-lekarstvo-ot-tsvetnyh-revoljutsij-415542-2020/ [17] https://vmeste-rf dot tv/news/strany-odkb-rabotayut-nad-edinymi-pravilami-tsifrovogo-prostranstva/; https://interfax dot by/news/policy/vneshnyaya_politika/1286775/ [18] https://vmeste-rf dot tv/news/strany-odkb-rabotayut-nad-edinymi-pravilami-tsifrovogo-prostranstva/; https://interfax dot by/news/policy/vneshnyaya_politika/1286775/ [19] http://www.understandingwar.org/backgrounder/kremlin-leverages-cyber-coo... [20] http://www.understandingwar.org/backgrounder/kremlin-leverages-cyber-coo...   
